{
  "$schema": "../schemas/good.schema.json",
  "kind": "good",
  "name": {
    "en": "Glass",
    "fr": "Verre"
  },
  "model": "goods-glass",
  "category": "construction",
  "recipe": {
    "clay": 2,
    "silicon": 1
  },
  "durationMinutes": 12,
  "value": 190,
  "unlockCitizens": 200,
  "minTier": 5
}
