{
  "$schema": "../schemas/good.schema.json",
  "kind": "good",
  "name": {
    "en": "Crystal",
    "fr": "Cristal"
  },
  "model": "goods-crystal",
  "category": "luxury",
  "recipe": {
    "sand": 1,
    "gold": 1
  },
  "durationMinutes": 28,
  "value": 850,
  "unlockCitizens": 1000,
  "minTier": 5
}
