{
  "$schema": "../schemas/good.schema.json",
  "kind": "good",
  "name": {
    "en": "Bricks",
    "fr": "Briques"
  },
  "model": "goods-bricks",
  "category": "construction",
  "recipe": {
    "stone": 2,
    "wood": 1
  },
  "durationMinutes": 4,
  "value": 34,
  "unlockCitizens": 0,
  "minTier": 1
}
